{
  "schemaVersion": "1.0",
  "orgId": "clearworksai",
  "datasetId": "semantic-evaluation-dataset:required-v1",
  "datasetDigest": "53f19b5a18f9b801c7716be05410b493dc7f02d6cad3e04b7af907b8a3f376e4",
  "policyVersion": "semantic-truth-prediction-v1",
  "meetingSplitDigest": "f92e516b162c0b9010c6fa6fb2418bb3a93f4fb7168303116edbbccd4867f3a6",
  "examples": [
    {
      "exampleId": "example:direction:01",
      "dimension": "direction",
      "stratumId": "stratum:direction:required",
      "meetingId": "meeting_eval_01",
      "truth": true,
      "prediction": true,
      "evidenceId": "evidence:direction:01",
      "evidenceDigest": "877a24fb44d6bb9c2016829ec8a52a2cbbe7598830a6160060fa5d73219f2bc7"
    },
    {
      "exampleId": "example:direction:02",
      "dimension": "direction",
      "stratumId": "stratum:direction:required",
      "meetingId": "meeting_eval_02",
      "truth": true,
      "prediction": true,
      "evidenceId": "evidence:direction:02",
      "evidenceDigest": "73416ab2e0937a44c1e59dbc80b7f063522e3db0602920202a495646646b02db"
    },
    {
      "exampleId": "example:direction:03",
      "dimension": "direction",
      "stratumId": "stratum:direction:required",
      "meetingId": "meeting_eval_03",
      "truth": true,
      "prediction": true,
      "evidenceId": "evidence:direction:03",
      "evidenceDigest": "2841e8872fecaca94cdeacb0dd43c38a4b212cbe4729924c0a9ee77a9748b0ce"
    },
    {
      "exampleId": "example:direction:04",
      "dimension": "direction",
      "stratumId": "stratum:direction:required",
      "meetingId": "meeting_eval_04",
      "truth": true,
      "prediction": true,
      "evidenceId": "evidence:direction:04",
      "evidenceDigest": "fffe535d50991081be37fade6e5bf8b43feda9b9301555baf744d9b1ffe3859f"
    },
    {
      "exampleId": "example:direction:05",
      "dimension": "direction",
      "stratumId": "stratum:direction:required",
      "meetingId": "meeting_eval_05",
      "truth": true,
      "prediction": true,
      "evidenceId": "evidence:direction:05",
      "evidenceDigest": "33f41e04bdcfbc4215aa1e348c5c33758f4311affa794bb12e49a2de66caa4ee"
    },
    {
      "exampleId": "example:direction:06",
      "dimension": "direction",
      "stratumId": "stratum:direction:required",
      "meetingId": "meeting_eval_06",
      "truth": true,
      "prediction": true,
      "evidenceId": "evidence:direction:06",
      "evidenceDigest": "650c2babb8b84af43974b6ae950c2f3bc7050fafa60e6c1bac1bf45c2c93e1d7"
    },
    {
      "exampleId": "example:direction:07",
      "dimension": "direction",
      "stratumId": "stratum:direction:required",
      "meetingId": "meeting_eval_07",
      "truth": true,
      "prediction": true,
      "evidenceId": "evidence:direction:07",
      "evidenceDigest": "d56c35680aec6474a8adac01100a84c9102bd7b5abb6d83d3e089c09b51b9f85"
    },
    {
      "exampleId": "example:direction:08",
      "dimension": "direction",
      "stratumId": "stratum:direction:required",
      "meetingId": "meeting_eval_08",
      "truth": true,
      "prediction": true,
      "evidenceId": "evidence:direction:08",
      "evidenceDigest": "e01bfa8ef5f545c54b01e3c888dfc956d60eb35a8c734b769725e2d1b7e94b57"
    },
    {
      "exampleId": "example:direction:09",
      "dimension": "direction",
      "stratumId": "stratum:direction:required",
      "meetingId": "meeting_eval_09",
      "truth": false,
      "prediction": false,
      "evidenceId": "evidence:direction:09",
      "evidenceDigest": "a227bfbae1737a008119d2f0689059693f0f3a2115faed185a164e791076159d"
    },
    {
      "exampleId": "example:direction:10",
      "dimension": "direction",
      "stratumId": "stratum:direction:required",
      "meetingId": "meeting_eval_10",
      "truth": false,
      "prediction": false,
      "evidenceId": "evidence:direction:10",
      "evidenceDigest": "cbca591ff961f68012c0908aec36c2184fe0a431e622ecedf6679d4b02c39f52"
    },
    {
      "exampleId": "example:direction:11",
      "dimension": "direction",
      "stratumId": "stratum:direction:required",
      "meetingId": "meeting_eval_11",
      "truth": false,
      "prediction": false,
      "evidenceId": "evidence:direction:11",
      "evidenceDigest": "8958de9b564d7943c039eb944a5071c999139eed3dd8c249557f33780ef1ef72"
    },
    {
      "exampleId": "example:direction:12",
      "dimension": "direction",
      "stratumId": "stratum:direction:required",
      "meetingId": "meeting_eval_12",
      "truth": false,
      "prediction": false,
      "evidenceId": "evidence:direction:12",
      "evidenceDigest": "b8fc45bce7605cbae294941b4331fecaafe80aaa5751d2c5657e93a99d19d902"
    },
    {
      "exampleId": "example:direction:13",
      "dimension": "direction",
      "stratumId": "stratum:direction:required",
      "meetingId": "meeting_eval_13",
      "truth": false,
      "prediction": false,
      "evidenceId": "evidence:direction:13",
      "evidenceDigest": "52b049ee47ce22698e2b2f634e638d4e8492e7597aa2d33b6491d900a2a84243"
    },
    {
      "exampleId": "example:direction:14",
      "dimension": "direction",
      "stratumId": "stratum:direction:required",
      "meetingId": "meeting_eval_14",
      "truth": false,
      "prediction": false,
      "evidenceId": "evidence:direction:14",
      "evidenceDigest": "3ec60706bdd5f0da2c27e2cdfb8941a428c721aa0617c6abb8b589646ce0e958"
    },
    {
      "exampleId": "example:direction:15",
      "dimension": "direction",
      "stratumId": "stratum:direction:required",
      "meetingId": "meeting_eval_15",
      "truth": false,
      "prediction": false,
      "evidenceId": "evidence:direction:15",
      "evidenceDigest": "f413b7b7353d9003ede013e5f6ec4492699cf44f5736a00db8302b2615530983"
    },
    {
      "exampleId": "example:direction:16",
      "dimension": "direction",
      "stratumId": "stratum:direction:required",
      "meetingId": "meeting_eval_16",
      "truth": false,
      "prediction": false,
      "evidenceId": "evidence:direction:16",
      "evidenceDigest": "3aaed0a071305557e29aa53f3303c8bc5725a79dd97d64d06232ac628f51a8f1"
    },
    {
      "exampleId": "example:work_state:01",
      "dimension": "work_state",
      "stratumId": "stratum:work_state:required",
      "meetingId": "meeting_eval_01",
      "truth": true,
      "prediction": true,
      "evidenceId": "evidence:work_state:01",
      "evidenceDigest": "ab8d614d24739eeffb07c46f8432f53cdef7f2276d8733d5b1078d96cf6cd6fc"
    },
    {
      "exampleId": "example:work_state:02",
      "dimension": "work_state",
      "stratumId": "stratum:work_state:required",
      "meetingId": "meeting_eval_02",
      "truth": true,
      "prediction": true,
      "evidenceId": "evidence:work_state:02",
      "evidenceDigest": "a69eb363334a81adf95214444f93d6cbb6bbdd2e8edd81289b710703639e20d6"
    },
    {
      "exampleId": "example:work_state:03",
      "dimension": "work_state",
      "stratumId": "stratum:work_state:required",
      "meetingId": "meeting_eval_03",
      "truth": true,
      "prediction": true,
      "evidenceId": "evidence:work_state:03",
      "evidenceDigest": "91cd51cbb45b9077b58e9fb332c7226e14555e4a0155075a76a5050e8240f7b7"
    },
    {
      "exampleId": "example:work_state:04",
      "dimension": "work_state",
      "stratumId": "stratum:work_state:required",
      "meetingId": "meeting_eval_04",
      "truth": true,
      "prediction": true,
      "evidenceId": "evidence:work_state:04",
      "evidenceDigest": "3f2340c2fda9a7c10c2267af2865247436c4a7711396eebf17304a2a5d6b9659"
    },
    {
      "exampleId": "example:work_state:05",
      "dimension": "work_state",
      "stratumId": "stratum:work_state:required",
      "meetingId": "meeting_eval_05",
      "truth": true,
      "prediction": true,
      "evidenceId": "evidence:work_state:05",
      "evidenceDigest": "9adb8e1a94d921dea3fcd25b25f204a457dd51ae16a81a290756426e896f1807"
    },
    {
      "exampleId": "example:work_state:06",
      "dimension": "work_state",
      "stratumId": "stratum:work_state:required",
      "meetingId": "meeting_eval_06",
      "truth": true,
      "prediction": true,
      "evidenceId": "evidence:work_state:06",
      "evidenceDigest": "799abfca9817b1a5fccc398c782a5e79134ff8b61ff5470e74033ecdc708c0dd"
    },
    {
      "exampleId": "example:work_state:07",
      "dimension": "work_state",
      "stratumId": "stratum:work_state:required",
      "meetingId": "meeting_eval_07",
      "truth": true,
      "prediction": true,
      "evidenceId": "evidence:work_state:07",
      "evidenceDigest": "c781c9be83bcbfec22527b4c3da733210a4ae6a4822ede6cf6a800d423038432"
    },
    {
      "exampleId": "example:work_state:08",
      "dimension": "work_state",
      "stratumId": "stratum:work_state:required",
      "meetingId": "meeting_eval_08",
      "truth": true,
      "prediction": true,
      "evidenceId": "evidence:work_state:08",
      "evidenceDigest": "3b22f6ee65b7a118d70d523d1629a45c32a5975063ba0643bffd9b3647a36785"
    },
    {
      "exampleId": "example:work_state:09",
      "dimension": "work_state",
      "stratumId": "stratum:work_state:required",
      "meetingId": "meeting_eval_09",
      "truth": false,
      "prediction": false,
      "evidenceId": "evidence:work_state:09",
      "evidenceDigest": "719cb68440836f3ac48bb93586329069367c72b162c2241eb89c8c1881e415b2"
    },
    {
      "exampleId": "example:work_state:10",
      "dimension": "work_state",
      "stratumId": "stratum:work_state:required",
      "meetingId": "meeting_eval_10",
      "truth": false,
      "prediction": false,
      "evidenceId": "evidence:work_state:10",
      "evidenceDigest": "6d1cd731c497536f02e1214c3e7b3391f38a892ecc518bd85613b3761eb0c635"
    },
    {
      "exampleId": "example:work_state:11",
      "dimension": "work_state",
      "stratumId": "stratum:work_state:required",
      "meetingId": "meeting_eval_11",
      "truth": false,
      "prediction": false,
      "evidenceId": "evidence:work_state:11",